index,published,keyword,domain,language,valid,title,description,url,image,archive,content,quote,de,en,la,added
8c4ef9b98237772b7ce41adefe5cffe8,2026-05-01T09:21:31Z,'Gewitter',www.zeit.de,de,0.9,Wetter: Erstes Maiwochenende: Schauer und Gewitter im Anmarsch,Hier finden Sie Informationen zu dem Thema „Wetter“. Lesen Sie jetzt „Erstes Maiwochenende: Schauer und Gewitter im Anmarsch“.,https://www.zeit.de/news/2026-05/01/erstes-maiwochenende-schauer-und-gewitter-im-anmarsch,https://img.zeit.de/news/2026-05/01/erstes-maiwochenende-schauer-und-gewitter-im-anmarsch-image-group/wide__1300x731,,Nach einem sommerlich anmutenden Mai-Feiertag kündigen sich ab Samstag zunehmend Wolken und Schauer an. Während die Menschen in Nordrhein-Westfalen mit strahlend blauem Himmel und Temperaturen bis zu… [+1118 chars],,Wetter: Erstes Maiwochenende: Schauer und Gewitter im Anmarsch. Hier finden Sie Informationen zu dem Thema „Wetter“. Lesen Sie jetzt „Erstes Maiwochenende: Schauer und Gewitter im Anmarsch“.,Weather: First weekend in May: showers and thunderstorms approaching. Here you will find information on the topic of “weather”. Read “First weekend in May: showers and thunderstorms approaching” now.,"Tempestas: prima volutpat mense Maio: imbres et tonitrua appropinquant. Hic informationes invenies in argumento ""tempestatis"". Lege ""Prima volutpat mense Maio: imbres et tonitrua appropinquantes"" nunc.",2026-05-02 19:58:07+00:00
93e859e5a627a5d9c305b7f90168b7c8,2026-05-01T11:20:17Z,'Gewitter',www.zeit.de,de,0.9,Wetteraussichten: Auf Sonne folgen Regenwolken und vereinzelte Gewitter,Hier finden Sie Informationen zu dem Thema „Wetteraussichten“. Lesen Sie jetzt „Auf Sonne folgen Regenwolken und vereinzelte Gewitter“.,https://www.zeit.de/news/2026-05/01/auf-sonne-folgen-regenwolken-und-vereinzelte-gewitter,https://img.zeit.de/news/2026-05/01/auf-sonne-folgen-regenwolken-und-vereinzelte-gewitter-image-group/wide__1300x731,,"Nach einem Hauch von Sommer am Maifeiertag erwartet die Menschen am Wochenende wieder vermehrt Regen und Wolken. Wie der Deutsche Wetterdienst (DWD) mitteilte, werden am Samstag in Rheinland-Pfalz un… [+1037 chars]",,Wetteraussichten: Auf Sonne folgen Regenwolken und vereinzelte Gewitter. Hier finden Sie Informationen zu dem Thema „Wetteraussichten“. Lesen Sie jetzt „Auf Sonne folgen Regenwolken und vereinzelte Gewitter“.,Weather outlook: Sunshine will be followed by rain clouds and isolated thunderstorms. Here you will find information on the topic of “Weather Prospects”. Now read “Sun is followed by rain clouds and isolated thunderstorms”.,"Tempestas prospectans: Sol imbribus nubibus sequetur et tonitrua solitaria. Hic informationes invenies in argumento ""Prospectus Tempestatis"". Nunc legitur ""Sol imbribus nubibus sequitur et tonitrua solitaria"".",2026-05-02 19:58:07+00:00
f907489b58240d9b85068dc360492cbc,2026-05-01T11:22:27Z,'Gewitter',www.zeit.de,de,0.9,Wetteraussichten: Trübe Aussichten zum Wochenende - Gewittergefahr steigt,Hier finden Sie Informationen zu dem Thema „Wetteraussichten“. Lesen Sie jetzt „Trübe Aussichten zum Wochenende - Gewittergefahr steigt“.,https://www.zeit.de/news/2026-05/01/truebe-aussichten-zum-wochenende-gewittergefahr-steigt,https://img.zeit.de/news/2026-05/01/truebe-aussichten-zum-wochenende-gewittergefahr-steigt-image-group/wide__1300x731,,"Auf Sonne satt am Maifeiertag folgen am Wochenende zunehmend trübe Aussichten für die Menschen in Hessen. Wie der Deutsche Wetterdienst (DWD) mitteilte, werden am Samstag Höchstwerte zwischen 23 und … [+950 chars]",,Wetteraussichten: Trübe Aussichten zum Wochenende - Gewittergefahr steigt. Hier finden Sie Informationen zu dem Thema „Wetteraussichten“. Lesen Sie jetzt „Trübe Aussichten zum Wochenende - Gewittergefahr steigt“.,Weather outlook: Cloudy outlook for the weekend - the risk of thunderstorms is increasing. Here you will find information on the topic of “Weather Prospects”. Now read “Gloomy prospects for the weekend – the risk of thunderstorms is increasing”.,"Tempestas prospectus: nubis prospectus volutpat - tonitruum periculum increscit. Hic informationes invenies in argumento ""Prospectus Tempestatis"". Nunc lege ""prospectus tristis volutpat - periculum tonitrui increscit"".",2026-05-02 19:58:07+00:00
7944f30484b228fc1dfb9ed20ae00b91,2026-05-01T15:02:00Z,'thunderstorm',consent.yahoo.com,en,0.7,Potential Sunday Thunderstorm Set to Throw a Curve Ball at the Miami Grand Prix,"With dark clouds on the horizon, F1's teams are bracing themselves for an unpredictable first go in the wet with the 2026 cars.",https://consent.yahoo.com/v2/collectConsent?sessionId=1_cc-session_d84b67d1-4ded-4f50-b589-21a16b954cab,,,"If you click 'Accept all', we and our partners, including 250 who are part of the IAB Transparency &amp; Consent Framework, will also store and / or access information on a device (in other words, us… [+1046 chars]",,Potenzielles Sonntagsgewitter wird beim Miami Grand Prix für einen Kurvenball sorgen. Mit dunklen Wolken am Horizont bereiten sich die F1-Teams auf einen unvorhersehbaren ersten Versuch im Nassen mit den 2026er-Autos vor.,"Potential Sunday Thunderstorm Set to Throw a Curve Ball at the Miami Grand Prix. With dark clouds on the horizon, F1's teams are bracing themselves for an unpredictable first go in the wet with the 2026 cars.","Potentia Solis Procellae Tonitruum iactare curvum Ball ad Miami Praefectum Urbi. Caliginosis nubibus in horizonte, iugis F1 se comprehendentes inaestimabile primum in udo cum 2026 carris eunt.",2026-05-03 14:14:39+00:00
f8ba5abae58adc66834c0aeb3954abbc,2026-05-01T08:32:01Z,'thunderstorm',www.motorsport.com,en,0.9,Why a wet F1 Miami GP would be so tricky – FIA addresses key concerns,"The FIA believes the chances of a cancellation due to a thunderstorm are small, but how could the weather still impact the Miami Grand Prix? And what are the biggest challenges for potentially the first wet-weather race with 2026 machinery?",https://www.motorsport.com/f1/news/why-a-wet-f1-miami-gp-would-be-so-tricky-fia-addresses-key-concerns/10816811/,https://s.yimg.com/os/en/motorsport_articles_445/1e52fc5a2c4daeae299236ae4b1708e3,,"During media day for the Miami Grand Prix, two topics dominated discussions with all drivers: the tweaks to the Formula 1 technical regulations and the weather forecast for Sunday. Although several t… [+7853 chars]",,"Warum ein nasser F1-GP in Miami so schwierig wäre – FIA geht auf wichtige Bedenken ein. Die FIA ​​hält die Wahrscheinlichkeit einer Absage aufgrund eines Gewitters für gering, aber wie könnte sich das Wetter trotzdem auf den Grand Prix von Miami auswirken? Und was sind die größten Herausforderungen für das möglicherweise erste Regenwetterrennen mit 2026er Maschinen?","Why a wet F1 Miami GP would be so tricky – FIA addresses key concerns. The FIA believes the chances of a cancellation due to a thunderstorm are small, but how could the weather still impact the Miami Grand Prix? And what are the biggest challenges for potentially the first wet-weather race with 2026 machinery?","Cur uda F1 Miami GP tam captiosa esset – FIA verba clavis interest. FIA credit casus cancellationis propter tonitribus parvas, sed quomodo tempestas adhuc Miami Praefectus Urbi impactus est? Et quae sunt maximae provocationes pro potentia primae tempestatis cum 2026 machinatione?",2026-05-03 14:14:39+00:00
