index,published,keyword,domain,language,valid,title,description,url,image,archive,content,quote,de,en,la,added
cdae70ccb42f66aa52f428097552eccd,2026-07-04T14:54:47Z,'thunderstorm',www.hitc.com,en,0.9,The fatal 1998 match that explains why FIFA World Cup thunderstorm rules are so strict,England’s Round of 16 clash against Mexico is still set to go ahead at 1am BST on Monday morning in the United Kingdom after a change of mind from FIFA. The match at the Estadio Azteca was briefly rescheduled for 7pm BST amid concerns there could be thunderst…,https://www.hitc.com/the-fatal-1998-match-that-explains-why-fifa-world-cup-thunderstorm-rules-are-so-strict/,https://s.yimg.com/ny/api/res/1.2/LffPAh27HpxM6KSWC40egg--/YXBwaWQ9aGlnaGxhbmRlcjt3PTEyMDA7aD04MDA7Y2Y9d2VicA--/https://media.zenfs.com/en/hitc_articles_832/4bcbde10fc434658339f9c3e241aad03,,"Englands Round of 16 clash against Mexico is still set to go ahead at 1am BST on Monday morning in the United Kingdom after a change of mind from FIFA.
The match at the Estadio Azteca was briefly re… [+2328 chars]",,"Das tödliche Spiel von 1998 erklärt, warum die Gewitterregeln der FIFA-Weltmeisterschaft so streng sind. Englands Achtelfinalduell gegen Mexiko wird nach einem Meinungswandel der FIFA weiterhin am Montagmorgen um 1 Uhr MEZ im Vereinigten Königreich stattfinden. Das Spiel im Estadio Azteca wurde kurzzeitig auf 19:00 Uhr BST verschoben, da befürchtet wurde, dass es zu Gewittern kommen könnte.",The fatal 1998 match that explains why FIFA World Cup thunderstorm rules are so strict. England’s Round of 16 clash against Mexico is still set to go ahead at 1am BST on Monday morning in the United Kingdom after a change of mind from FIFA. The match at the Estadio Azteca was briefly rescheduled for 7pm BST amid concerns there could be thunderst…,"Fatalis 1998 compositus est, cur FIFA World Cup regit tonitrui tam stricte. In Anglia circa 16 collisiones contra Mexicum etiamnum praecedere 1am BST die Lunae mane in Britannia post mutationem mentis a FIFA proficiscitur. Certamen in Estadio Azteca breviter resectum est propter 7pm BST inter curas tonitrui esse potuisse.",2026-07-13 15:51:08+00:00
6f5313237a6c64ef2b5b7f8f17f780e5,2026-07-04T16:46:00Z,'lightning and thunder',onefootball.com,en,0.9,⛈️ Weather chaos in the USA! World Cup last-16 tie faces delay,"In its current form, it seems that only the weather can stop France from winning the 2026 World Cup title. After the French were temporarily halted by lightning and thunder during their 3–0 group-st...",https://onefootball.com/en/news/weather-chaos-in-the-usa-world-cup-last-16-tie-faces-delay-43096713,https://s.yimg.com/lo/mysterio/api/1b8b453a0b7a0e1a01eb6e3b26d960af02f9c30f8aec0002550ddc18ea1d810e/lightyear_networkapi/resizefill_w1200;quality_80;format_webp/https:%2F%2Fmedia.zenfs.com%2Fen%2Fonefootball_articles_802%2F2708f66319246423582aa5b42b1c8728,http://web.archive.org/web/20260705051209/https://onefootball.com/en/news/weather-chaos-in-the-usa-world-cup-last-16-tie-faces-delay-43096713,"In its current form, it seems that only the weather can stop France from winning the 2026 World Cup title. After the French were temporarily halted by lightning and thunder during their 30 group-stag… [+589 chars]",,"⛈️ Wetterchaos in den USA! WM-Achtelfinale droht Verzögerung. In seiner jetzigen Form scheint es, dass nur das Wetter Frankreich davon abhalten kann, den WM-Titel 2026 zu gewinnen. Nachdem die Franzosen während ihres 3:0-Gruppenspiels vorübergehend von Blitz und Donner gestoppt wurden ...","⛈️ Weather chaos in the USA! World Cup last-16 tie faces delay. In its current form, it seems that only the weather can stop France from winning the 2026 World Cup title. After the French were temporarily halted by lightning and thunder during their 3–0 group-st...","⛈️ Tempestas chaos in USA! tandem Mundi cup-16 tis mora facies. In forma hodierna, videtur quod sola tempestas Franciam prohibere possit titulum 2026 World Cup conciliare. Post Francos fulminibus et tonitruis ad tempus represserunt in eorum 3-0 globus-st...",2026-07-13 15:51:08+00:00
664ced966a152bd18ce82db4ae5f7a48,2026-07-05T22:00:46Z,'thunderstorm',www.hitc.com,en,0.9,What is thunderstorm protocol? Mexico vs England expected to be delayed,"Intense weather conditions at the Azteca Stadium today means England’s World Cup clash with Mexico is expected to be delayed. The venue, which sits at an altitude 2,240m (7,220 feet), has been hit by thunderstorms, and all the latest advice and signage around…",https://www.hitc.com/what-is-thunderstorm-protocol-mexico-vs-england-expected-to-be-delayed/,https://s.yimg.com/lo/mysterio/api/2e93addaaaff6f23a1c257995e75341eff20845c4af5d01ef74bd671ef7e0804/lightyear_networkapi/resizefill_w1200;quality_80;format_webp/https:%2F%2Fmedia.zenfs.com%2Fen%2Fhitc_articles_832%2Ff6dd62637800ce01184b40d94b3acfdd,http://web.archive.org/web/20260708012356/https://www.hitc.com/what-is-thunderstorm-protocol-mexico-vs-england-expected-to-be-delayed/,"Intense weather conditions at the Azteca Stadium today means England's World Cup clash with Mexico is expected to be delayed.
The venue, which sits at an altitude 2,240m (7,220 feet), has been hit b… [+1072 chars]",,"Was ist das Gewitterprotokoll? Mexiko gegen England dürfte sich verzögern. Heutige Wetterbedingungen im Azteca-Stadion bedeuten, dass sich das WM-Duell zwischen England und Mexiko voraussichtlich verzögern wird. Der Veranstaltungsort, der auf einer Höhe von 2.240 m (7.220 Fuß) liegt, wurde von Gewittern heimgesucht, und die neuesten Hinweise und Beschilderungen rund um …","What is thunderstorm protocol? Mexico vs England expected to be delayed. Intense weather conditions at the Azteca Stadium today means England’s World Cup clash with Mexico is expected to be delayed. The venue, which sits at an altitude 2,240m (7,220 feet), has been hit by thunderstorms, and all the latest advice and signage around…","Quid est protocollum tonitrui? Mexico vs Anglia morari expectat. Conditiones tempestatum ingentes apud Stadium Azteca hodie significat Antipolis World Cup cum Mexico morari expectat. Vena, quae in altitudine 2,240m sedet (7,220 pedes), tonitruum ictus est, et omnia postrema consilia ac signage circa…",2026-07-13 15:51:08+00:00
6b4935f9333382e24406227a1ad49ea7,2026-07-10T13:00:35Z,'Stromausfall',www.zeit.de,de,0.9,Parteien: Konsequenz nach Stromausfall: Wegner tritt nicht wieder an,Hier finden Sie Informationen zu dem Thema „Parteien“. Lesen Sie jetzt „Konsequenz nach Stromausfall: Wegner tritt nicht wieder an“.,https://www.zeit.de/news/2026-07/10/konsequenz-nach-stromausfall-wegner-tritt-nicht-wieder-an,https://img.zeit.de/administratives/sharing/fallback-image-die-zeit/wide__1300x731,http://web.archive.org/web/20260711014913/https://www.zeit.de/news/2026-07/10/konsequenz-nach-stromausfall-wegner-tritt-nicht-wieder-an,Berlins Regierender Bürgermeister Kai Wegner gibt nach dpa-Informationen seine Spitzenkandidatur für die CDU zur Abgeordnetenhauswahl im September auf. Er soll demnach bis zur Wahl jedoch Regierender… [+60 chars],,Parteien: Konsequenz nach Stromausfall: Wegner tritt nicht wieder an. Hier finden Sie Informationen zu dem Thema „Parteien“. Lesen Sie jetzt „Konsequenz nach Stromausfall: Wegner tritt nicht wieder an“.,Parties: Consequence after power outage: Wegner will not run again. Here you will find information on the topic of “parties”. Now read “Consequence after a power outage: Wegner will not run again”.,"Partes: Consequentia post eu ipsum potentia: Wegner non iterum currere. Hic informationes invenies in argumento ""partium"". Nunc lege ""Consecutio post eu potentia: Wegner non iterum currere"".",2026-07-14 05:09:17+00:00
000f5e60f3f249fa5b06f9b926841a64,2026-07-10T13:02:47Z,'Stromausfall',www.morgenpost.de,de,0.9,Kai Wegners Krisenmanagement: Wann hat der Regierende Bürgermeister was gesagt?,"Der Stromausfall in Berlin stürzt Kai Wegner in eine schwere Krise. Diese Übersicht zeigt, wie er sich anschließend geäußert hat.",https://www.morgenpost.de/berlin/article412541092/kai-wegners-krisenmanagement-wann-hat-der-regierende-buergermeister-was-gesagt.html,https://img.sparknews.funkemedien.de/410902137/410902137_1783688696_v16_9_1600.jpeg,,Es war ein tagelanger Krisenfall und für Kai Wegner ist er das bis heute: Der Anschlag auf die Berliner Stromversorgung am 3. Januar hat ein mehrtägiges Chaos in der Hauptstadt ausgelöst. Im Nachhine… [+3037 chars],,"Kai Wegners Krisenmanagement: Wann hat der Regierende Bürgermeister was gesagt?. Der Stromausfall in Berlin stürzt Kai Wegner in eine schwere Krise. Diese Übersicht zeigt, wie er sich anschließend geäußert hat.",Kai Wegner's crisis management: When did the governing mayor say something? The power outage in Berlin plunges Kai Wegner into a serious crisis. This overview shows how he subsequently expressed himself.,Kai Wegner discriminis procuratio: Quando gubernator maior aliquid dixit? Potestas euaxationis Berolinensi in grave discrimen Kai Wegner mergit. Haec sententia ostendit quomodo postea se expressit.,2026-07-14 05:09:17+00:00
28027fa755c99f01d8d21d75abe47567,2026-07-10T13:15:23Z,'Stromausfall',www.sueddeutsche.de,de,0.9,Regierender Bürgermeister Kai Wegner zieht Spitzenkandidatur zurück,Zehn Wochen vor der Wahl des Abgeordnetenhauses muss sich die CDU einen neuen Spitzenkandidaten suchen. Wegner stand wochenlang in der Kritik wegen seines Krisenmanagements beim Stromausfall im Januar.,https://www.sueddeutsche.de/politik/berlin-kai-wegner-kandidatur-wahl-rueckzug-li.3513956,https://www.sueddeutsche.de/2026/07/10/d9fddb6c-bc76-4f85-8bb5-1f06337753ea.jpg?q=60&fm=webp&width=1200&rect=0%2C174%2C4000%2C2250,http://web.archive.org/web/20260711050405/https://www.sueddeutsche.de/politik/berlin-kai-wegner-kandidatur-wahl-rueckzug-li.3513956,"Es sind nur noch gut zehn Wochen, bis die Berlinerinnen und Berliner ihr neues Landesparlament wählen. Wegner, der erneut kandidieren wollte, steht seit Monaten in der Kritik. Nicht nur die Oppositio… [+920 chars]",,Regierender Bürgermeister Kai Wegner zieht Spitzenkandidatur zurück. Zehn Wochen vor der Wahl des Abgeordnetenhauses muss sich die CDU einen neuen Spitzenkandidaten suchen. Wegner stand wochenlang in der Kritik wegen seines Krisenmanagements beim Stromausfall im Januar.,"Governing Mayor Kai Wegner withdraws top candidate. Ten weeks before the House of Representatives election, the CDU has to look for a new top candidate. Wegner was criticized for weeks because of his crisis management during the power outage in January.",Praefectus Major Kai Wegner candidatus supremam recedit. Decem hebdomades ante Domus Legatorum electionem CDU novum candidatum top quaerendum habet. Wegner per hebdomades reprehendebatur propter crisim administrationis suae potestatis eui Ianuario mense.,2026-07-14 05:09:17+00:00
53358fb892c84baf57cb5aca19495753,2026-07-10T13:17:19Z,'Stromausfall',www.derstandard.de,de,0.9,Berlins Bürgermeister Kai Wegner zieht Kandidatur zurück,Der CDU-Politiker stand wegen seinem Krisenmanagment nach dem großen Stromausfall in der Kritik. Bei der Wahl am 20. September will er nicht erneut antreten,https://www.derstandard.de/story/3000000331012/berlins-buergermeister-kai-wegner-zieht-szurueck,https://i.ds.at/DuI6Tg/rs:fill:1200:600/plain/lido-images/2026/07/10/fcb09149-4ac2-4c53-979d-e193108d35f4.jpg,http://web.archive.org/web/20260711064709/https://www.derstandard.de/story/3000000331012/berlins-buergermeister-kai-wegner-zieht-szurueck,"Sie entscheiden darüber, wie Sie unsere Inhalte nutzen wollen. Ihr Gerät erlaubt uns derzeit leider nicht, die entsprechenden Optionen anzuzeigen.
Bitte deaktivieren Sie sämtliche Hard- und Software… [+180 chars]",,Berlins Bürgermeister Kai Wegner zieht Kandidatur zurück. Der CDU-Politiker stand wegen seinem Krisenmanagment nach dem großen Stromausfall in der Kritik. Bei der Wahl am 20. September will er nicht erneut antreten,Berlin Mayor Kai Wegner withdraws his candidacy. The CDU politician was criticized for his crisis management after the major power outage. He does not want to run again in the election on September 20th,Berolini Major Kai Wegner suam petitionem recedit. Politicus CDU in administratione discriminis sui reprehensus est post eumissionem maioris potestatis. Non vult iterum currere in comitiis die 20 Septembris,2026-07-14 05:09:17+00:00
f745cd575a4dbc6cfff76ef4ba8699bf,2026-07-10T13:24:35Z,'Stromausfall',orf.at,de,0.9,Nach Stromausfall: Berlins Bürgermeister tritt nicht mehr an,,https://orf.at/stories/3435856/,https://orf.at/mojo/1_4_1/storyserver//news/common/images/og-fallback-news.png,http://web.archive.org/web/20260711053702/https://orf.at/stories/3435856/,Berlins regierender Bürgermeister Kai Wegner gibt seine Spitzenkandidatur für die CDU zur Abgeordnetenhauswahl im September auf. Er soll bis zur Wahl jedoch regierender Bürgermeister bleiben. Wegner … [+1060 chars],,Nach Stromausfall: Berlins Bürgermeister tritt nicht mehr an. None,After a power outage: Berlin's mayor is no longer running. None,Post upgrade potentiae: maior Berolini non iam currit. Nullus,2026-07-14 05:09:17+00:00
f37e80fa5576f156857ffc11828f8ea0,2026-07-10T13:55:32Z,'Stromausfall',www.tagesspiegel.de,de,0.9,Die Folgen des Wegner-Rückzugs: Finanzsenator Evers gilt als Favorit auf die CDU-Spitzenkandidatur,Seit dem Stromausfall im Januar stand Berlins Regierungschef Kai Wegner unter Druck. Nun führt er seine Partei nicht mehr im Wahlkampf an. Die aktuellen Entwicklungen im Blog.,https://www.tagesspiegel.de/berlin/liveblog/die-folgen-des-wegner-ruckzugs-finanzsenator-evers-gilt-als-favorit-auf-die-cdu-spitzenkandidatur-15827762.html,https://www.tagesspiegel.de/images/15828247/alternates/BASE_16_9_W1400/1783691721000/plenarsitzung-berliner-abgeordnetenhaus.jpeg,,Berlins Regierender Bürgermeister Kai Wegner gibt seine Spitzenkandidatur für die CDU zur Abgeordnetenhauswahl im September auf. Er will jedoch bis zur Wahl Regierender Bürgermeister bleiben. Wegner … [+142 chars],,Die Folgen des Wegner-Rückzugs: Finanzsenator Evers gilt als Favorit auf die CDU-Spitzenkandidatur. Seit dem Stromausfall im Januar stand Berlins Regierungschef Kai Wegner unter Druck. Nun führt er seine Partei nicht mehr im Wahlkampf an. Die aktuellen Entwicklungen im Blog.,"The consequences of Wegner's withdrawal: Finance Senator Evers is considered the favorite to become the CDU's top candidate. Since the power outage in January, Berlin's Prime Minister Kai Wegner has been under pressure. Now he is no longer leading his party in the election campaign. The current developments in the blog.","Consequentiae recessus Wegner: Senator Evers oeconomus censetur gratissimus ut candidatus summo CDU fiet. Cum potestas upgrade mense Ianuario, primus minister Kai Wegner Berolinensis sub pressione fuit. Iam non amplius partium electionem in expeditionem ducens. Explicationes hodiernae in diario.",2026-07-14 05:09:17+00:00
6412729f4401ce0be23a3ffa3f823ee5,2026-07-10T14:18:21Z,'Stromausfall',www.diepresse.com,de,0.9,„Tennis-Affäre“: Berliner Bürgermeister zieht Kandidatur zurück,Kai Wegner stand nach dem großen Stromausfall im Winter heftig in der Kritik. Jüngst nahm die Debatte darüber wieder Fahrt auf.,https://www.diepresse.com/36642705/tennis-affaere-berliner-buergermeister-zieht-kandidatur-zurueck,https://img.diepresse.com/public/incoming/454o1a-germany-politicsberlin/alternates/WEBP_WIDE_1200/GERMANY-POLITICSBERLIN,http://web.archive.org/web/20260711152451/https://www.diepresse.com/36642705/tennis-affaere-berliner-buergermeister-zieht-kandidatur-zurueck,"Die Presse auf Google als bevorzugte Nachrichtenquelle hinzufügen.
 Der Berliner Bürgermeister Kai Wegner gibt nach dpa-Informationen seine Spitzenkandidatur für die CDU zur Abgeordnetenhauswahl im … [+2019 chars]",,„Tennis-Affäre“: Berliner Bürgermeister zieht Kandidatur zurück. Kai Wegner stand nach dem großen Stromausfall im Winter heftig in der Kritik. Jüngst nahm die Debatte darüber wieder Fahrt auf.,“Tennis affair”: Berlin mayor withdraws candidacy. Kai Wegner was heavily criticized after the major power outage in winter. The debate about this has recently picked up speed again.,"""Tennis res"": maior Berolini petitionem recedit. Kai Wegner graviter reprehendit post euum in hieme maiorem potestatem. Disceptatio de hac celeritate iterum nuper sustulit.",2026-07-14 05:09:17+00:00
1849c669c1451999d00d0485f1e205d4,2026-07-10T14:52:03Z,'Stromausfall',www.diepresse.com,de,0.9,Aus nach Blackout: Berliner Bürgermeister gibt auf [premium],Krisenmanagement bei Stromausfall kostet Kai Wegner das Amt.,https://www.diepresse.com/36657858/aus-nach-blackout-berliner-buergermeister-gibt-auf,https://img.diepresse.com/public/incoming/wbcqp-germany-politicsberlin/alternates/WEBP_WIDE_1200/GERMANY-POLITICSBERLIN,http://web.archive.org/web/20260710233239/https://www.diepresse.com/36657858/aus-nach-blackout-berliner-buergermeister-gibt-auf,"Wien/Berlin. Ein Absturz in den Umfragewerten, neue Enthüllungen über sein Krisenmanagement, ein bevorstehender parteiinterner Putsch, Personalquerelen: Ein halbes Jahr nach dem peinlichen Stromausfa… [+2663 chars]",,Aus nach Blackout: Berliner Bürgermeister gibt auf [premium]. Krisenmanagement bei Stromausfall kostet Kai Wegner das Amt.,Out after blackout: Berlin mayor gives up [premium]. Crisis management in the event of a power outage costs Kai Wegner his office.,Out after blackout: Berlin maior dat [premium]. Discriminis procuratio in eventu potestatis euentionis constat Kai Wegner suum officium esse.,2026-07-14 05:09:17+00:00
ee8dd94b06acc5d14f60b8dd3316af20,2026-07-10T15:18:18Z,'Stromausfall',www.tagesspiegel.de,de,0.9,CDU-Wahlkampf: Linke: Wegners Rückzug war „überfällig“,"Elif Eralp wirft Wegner vor, die Berliner beim Stromausfall belogen zu haben. Das sei ein Schaden für die Politik insgesamt.",https://www.tagesspiegel.de/berlin/cdu-wahlkampf-linke-wegners-ruckzug-war-uberfallig-15828642.html,https://www.tagesspiegel.de/images/15828641/alternates/BASE_16_9_W1400/1783696699000/elif-eralp-die-linke-spitzenkandidatin-der-linken-in-berlin.jpeg,http://web.archive.org/web/20260711154016/https://www.tagesspiegel.de/berlin/cdu-wahlkampf-linke-wegners-ruckzug-war-uberfallig-15828642.html,"Die Spitzenkandidatin der Berliner Linken, Elif Eralp, hat den Rückzug von Kai Wegner begrüßt. Das war überfällig, teilte Eralp mit. Wegner sei nicht zurückgetreten, er wurde zum Rücktritt gedrängt. … [+286 chars]",,"CDU-Wahlkampf: Linke: Wegners Rückzug war „überfällig“. Elif Eralp wirft Wegner vor, die Berliner beim Stromausfall belogen zu haben. Das sei ein Schaden für die Politik insgesamt.",CDU election campaign: Left: Wegner's withdrawal was “overdue”. Elif Eralp accuses Wegner of lying to Berliners about the power outage. This is damaging to politics as a whole.,"CDU militia electionis: Left: Wegner recessus ""decuit"". Elif Eralp accusat Wegner mentiendi Berliners de virtute eu. Hoc totum rei publicae damnosum est.",2026-07-14 05:09:17+00:00
b6fecc2942cc8350e2e624c5cda6c473,2026-07-10T15:33:08Z,'Stromausfall',www.n-tv.de,de,0.9,Berliner CDU in Trümmern: Kai Wegner zieht die Notbremse nach dem Crash,"Seit Januar, seit Teile Berlins im Dunkeln saßen, gärt die Debatte um Kai Wegner. Was hat der Regierende Bürgermeister am ersten Tag des Stromausfalls gemacht, außer Tennis zu spielen? Monatelang hatte er Zeit, alle Widersprüche aufzuklären. Bis es zu spät wa…",https://www.n-tv.de/politik/politik_kommentare/Kommentar-zum-Ruecktritt-von-Kai-Wegner-in-Berlin-Der-Regierende-Buergermeister-zieht-die-Notbremse-nach-dem-Crash-id31073271.html,https://www.n-tv.de/img/31073037/1783703308/Img_16_9/1200/ARCHIV-06-07-2026-Berlin-Berlins-Regierender-Buergermeister-Kai-Wegner-CDU-spricht-waehrend-der-Pressekonferenz-der-Expertenkommission-zum-grossen-Stromausfall-Anfang-des-Jahres-2026.jpg,http://web.archive.org/web/20260711034414/https://www.n-tv.de/politik/politik_kommentare/Kommentar-zum-Ruecktritt-von-Kai-Wegner-in-Berlin-Der-Regierende-Buergermeister-zieht-die-Notbremse-nach-dem-Crash-id31073271.html,"Kai Wegner tritt als Spitzenkandidat der CDU zurück, bleibt aber vorerst Regierender Bürgermeister. (Foto: dpa)
Seit Januar, seit Teile Berlins im Dunkeln saßen, gärt die Debatte um Kai Wegner. Was … [+3564 chars]",,"Berliner CDU in Trümmern: Kai Wegner zieht die Notbremse nach dem Crash. Seit Januar, seit Teile Berlins im Dunkeln saßen, gärt die Debatte um Kai Wegner. Was hat der Regierende Bürgermeister am ersten Tag des Stromausfalls gemacht, außer Tennis zu spielen? Monatelang hatte er Zeit, alle Widersprüche aufzuklären. Bis es zu spät wa…","Berlin CDU in ruins: Kai Wegner pulls the emergency brake after the crash. The debate about Kai Wegner has been brewing since January, when parts of Berlin were left in the dark. What did the governing mayor do on the first day of the power outage other than play tennis? He had months to clear up all the contradictions. Until it's too late...","Berlin CDU in ruinis: Kai Wegner tumultum fregit post fragorem trahit. Disceptatio de Kai Wegner ab Ianuario miscenda est, cum partes Berolini in tenebris relictae sunt. Quid gubernans maior fecit primo die potestatis euum aliud quam lusum tennis? Habebat menses omnes contradictiones purgare. Donec tempus est...",2026-07-14 05:09:17+00:00
adc932b75756237c10f86a5bc409d035,2026-07-10T15:48:49Z,'Stromausfall',www.zeit.de,de,0.9,Berlinwahl: Wie ein Stromausfall Kai Wegner zum Verhängnis wurde,"Der CDU droht bei der Berlinwahl im September eine Niederlage, in Umfragen ist sie eingebrochen. Jetzt gibt Kai Wegner auf. Warum und wie geht es mit der Partei weiter?",https://www.zeit.de/politik/deutschland/2026-07/kai-wegner-ruecktritt-spitzenkandidatur-berlin-wahl-faq,https://img.zeit.de/politik/deutschland/2026-07/kai-wegner-ruecktritt-spitzenkandidatur-berlin-wahl-faq-bild/wide__1300x731,http://web.archive.org/web/20260711032554/https://www.zeit.de/politik/deutschland/2026-07/kai-wegner-ruecktritt-spitzenkandidatur-berlin-wahl-faq,"Schließen
Artikelzusammenfassung
Berlin wird im September einen neuen Regierenden Bürgermeister bekommen, da Amtsinhaber Kai Wegner nach einem massiven Stromausfall seine Spitzenkandidatur zurückge… [+755 chars]",,"Berlinwahl: Wie ein Stromausfall Kai Wegner zum Verhängnis wurde. Der CDU droht bei der Berlinwahl im September eine Niederlage, in Umfragen ist sie eingebrochen. Jetzt gibt Kai Wegner auf. Warum und wie geht es mit der Partei weiter?",Berlin election: How a power outage became Kai Wegner's undoing. The CDU is threatened with defeat in the Berlin elections in September and has collapsed in the polls. Now Kai Wegner is giving up. Why and what happens next for the party?,Berlin comitia: Quomodo potestas upgrade facta Kai Wegner interiit. CDU in comitiis Berolinensi mense Septembri cladem imminet et in repulsam procidit. Nunc Kai Wegner omittitur. Cur et quid deinde pro parte fit?,2026-07-14 05:09:17+00:00
5ab4372f930a1881488ca8dedf0c25ba,2026-07-10T16:23:00Z,'Stromausfall',www.dw.com,de,0.9,Zu viele Unwahrheiten: Berlins Regierungschef Wegner gibt auf,"Kai Wegner, der Regierende Bürgermeister von Berlin, will im Herbst nicht wieder für das Amt kandidieren. Seine dubiose Rolle beim Stromausfall im Januar hat ihm schwer geschadet Am Ende war es die eine kleine Unwahrheit zu viel, war der Unmut über die letzte…",https://www.dw.com/de/kai-wegner-berlins-regierender-buergermeister-gibt-auf-deutschland/a-77909693,https://static.dw.com/image/77909890_6.jpg,http://web.archive.org/web/20260710213040/https://www.dw.com/de/kai-wegner-berlins-regierender-buergermeister-gibt-auf-deutschland/a-77909693,"Am Ende war es die eine kleine Unwahrheit zu viel, war der Unmut über die letzten Monate voller Ungereimtheiten selbst bei seinen engsten Freunden zu groß geworden: Kai Wegner, Regierender Bürgermeis… [+5102 chars]",,"Zu viele Unwahrheiten: Berlins Regierungschef Wegner gibt auf. Kai Wegner, der Regierende Bürgermeister von Berlin, will im Herbst nicht wieder für das Amt kandidieren. Seine dubiose Rolle beim Stromausfall im Januar hat ihm schwer geschadet Am Ende war es die eine kleine Unwahrheit zu viel, war der Unmut über die letzte…","Too many untruths: Berlin's Prime Minister Wegner is giving up. Kai Wegner, the governing mayor of Berlin, does not want to run for office again in the fall. His dubious role in the power outage in January caused him serious damage. In the end it was one little untruth too many, was the displeasure over the last...","Nimis multa falsa sunt: ​​primus minister Wegner Berolinensis renuntiat. Kai Wegner, maior gubernii Berolinensis, munus iterum in ruinam currere non vult. Munus eius dubiae potestatis eui mense Ianuario ei grave damnum intulit. In fine erat unum parvum falsum nimium multis, displicebat ultimis.",2026-07-14 05:09:17+00:00
